{
  "schema": "daliuren-glossary/1.0",
  "glossary_version": "0.2",
  "profile_ref": "da-liu-ren-rules/0.2",
  "notes": "每条术语必须标注当前实现口径；口径字段与引擎 meta.rule_profile 对应项保持一致，算法未校准前不得使用确定性吉凶表述。",
  "terms": [
    {
      "id": "si_ke",
      "term": "四课",
      "related_profile_rule": "gan_ji_gong",
      "definition": "由日干（按寄宫落位）与日支各取天盘上神成一课，再各取其上神之上叠成一课，共四课，是一课盘面的骨架结构。",
      "caliber": "日干寄宫采用：甲寅、乙辰、丙巳、丁未、戊巳、己未、庚申、辛戌、壬亥、癸丑。"
    },
    {
      "id": "san_chuan",
      "term": "三传",
      "related_profile_rule": "san_chuan",
      "definition": "从四课中按九宗门规则选出的三个发用之支，依次称初传、中传、末传，表示事情的发端、发展、归结三个阶段。",
      "caliber": "本实现的九宗门顺序：伏吟课→返吟课→贼克（含比用、涉害细分）→遥克→昴星→别责→八专。"
    },
    {
      "id": "chu_chuan",
      "term": "初传",
      "related_profile_rule": "san_chuan",
      "definition": "三传的发端，也叫发用，代表事情的起因与切入点是哪一神。",
      "caliber": "由九宗门规则选定，页面标注其遁干与六亲。"
    },
    {
      "id": "zhong_chuan",
      "term": "中传",
      "related_profile_rule": "san_chuan",
      "definition": "三传的中段，代表事情发展的中间过程。",
      "caliber": "传统取法为初传所上之神；具体以本课课体所出为准。"
    },
    {
      "id": "mo_chuan",
      "term": "末传",
      "related_profile_rule": "san_chuan",
      "definition": "三传的归结，代表事情的收束阶段与落点。",
      "caliber": "传统取法为中传所上之神；具体以本课课体所出为准。"
    },
    {
      "id": "yue_jiang",
      "term": "月将",
      "related_profile_rule": "yue_jiang",
      "definition": "太阳所在宫次的古名（登明亥、河魁戌、从魁酉、传送申、小吉未、胜光午、太乙巳、天罡辰、太冲卯、功曹寅、大吉丑、神后子），以月将加占时起天盘。",
      "caliber": "默认中气过宫：太阳于十二中气交节时刻（精确到分）换将，即雨水亥、春分戌、谷雨酉、小满申、夏至未、大暑午、处暑巳、秋分辰、霜降卯、小雪寅、冬至丑、大寒子；古法十二定切点为对照口径（参数 yuejiang_method，界面不暴露选项）。"
    },
    {
      "id": "gui_ren",
      "term": "贵人",
      "related_profile_rule": "gui_ren",
      "definition": "十二神将之首，昼夜各有一贵人落宫，是推演神将顺逆的基准点。",
      "caliber": "昼夜贵人按『甲戊庚牛羊，乙己鼠猴乡，丙丁猪鸡位，壬癸蛇兔藏，六辛逢马虎』查表；卯时至申时算白天用阳贵，其余时辰用阴贵。"
    },
    {
      "id": "ke_shi",
      "term": "课式",
      "related_profile_rule": "san_chuan",
      "definition": "对三传由哪种取法结构取得的命名，如元首、重审、知一、涉害、遥克、昴星、别责、八专、伏吟、返吟。",
      "caliber": "接口 san_chuan.ke_shi 数组首项即本盘九宗门名，其后为细粒度课名。"
    },
    {
      "id": "liu_qin",
      "term": "六亲",
      "related_profile_rule": "liu_qin",
      "definition": "以日干为『我』，对三传地支论生克：克我为官鬼、生我为父母、同我为兄弟、我生为子孙、我克为妻财。",
      "caliber": "六亲由日干与三传地支的五行关系推导，不涉藏干折算。"
    },
    {
      "id": "xun_kong",
      "term": "旬空",
      "related_profile_rule": "four_pillars",
      "definition": "日柱所在六十甲子旬中没有配到地支的两个地支，又称空亡，表示该支落空、力量不实。",
      "caliber": "以日柱旬首推定，接口字段为 ba_zi.xun_kong_1 / ba_zi.xun_kong_2。"
    },
    {
      "id": "tian_di_pan",
      "term": "天地盘",
      "related_profile_rule": "yue_jiang",
      "definition": "地盘十二支固定不动（寅卯辰…丑分布十二宫），天盘以月将加占时旋转一周而成；盘上每一支有上神、神将与遁干。",
      "caliber": "天盘由『月将加正时』生成；月将默认中气过宫（精确到分）；时辰精确到时（双小时），分钟不参与。"
    },
    {
      "id": "shen_jiang",
      "term": "十二神将",
      "related_profile_rule": "shen_jiang",
      "definition": "贵人、螣蛇、朱雀、六合、勾陈、青龙、天空、白虎、太常、玄武、太阴、天后，随从贵人落宫布于天盘之上。",
      "caliber": "贵人在亥子丑寅卯辰则顺布，在巳午未申酉戌则逆布。"
    },
    {
      "id": "dun_gan",
      "term": "遁干",
      "related_profile_rule": "dun_gan",
      "definition": "按日所在旬的旬首起甲子、逐位顺飞十干而得到的隐藏天干，用于三传与天盘干支组合的详推。",
      "caliber": "本实现以日旬首为起点顺飞，戌、亥两位落旬空无遁干（输出空字符串）。"
    },
    {
      "id": "gua_ti",
      "term": "卦体",
      "related_profile_rule": "gua_ti",
      "definition": "对一课整体结构特征的命名，如三奇、六仪、龙德、官爵、轩盖、铸印、斫轮、罗网、九丑、连茹、连珠、伏吟、返吟。",
      "caliber": "2.0.0 仅输出卦体名称，不附吉凶断语；算法口径尚未完成校准。"
    },
    {
      "id": "shen_sha",
      "term": "神煞",
      "definition": "按年、月、日与地支分组排布的辅助符号系统，是大六壬课外的参考信息。",
      "caliber": "神煞规则尚未完成逐条校准，仅作结构化展示，不作为断语依据。"
    }
  ]
}
